{
  "id": "01J0000000000000INHERIT0SES",
  "persona_id": "01J000000000000000000PERSONA",
  "members": [],
  "title": "Inherits model from persona",
  "kind": "chat",
  "status": "active",
  "pinned": false,
  "model": null,
  "token_count": 0,
  "version": 1,
  "created_at": "2026-07-28T00:00:00Z",
  "updated_at": "2026-07-28T00:00:00Z"
}
