{
  "id": "01J000000000000000000WS001",
  "version": 1,
  "persona_id": "01J00000000000000000000P01",
  "members": [],
  "kind": "chat",
  "status": "active",
  "pinned": false,
  "model": null,
  "workspace": "/home/user/projects/coqui",
  "token_count": 0,
  "created_at": "2026-07-28T12:00:00Z",
  "updated_at": "2026-07-28T12:00:00Z"
}
